name,meaning,name_origin,meaning_origin,birth_flower,trivia,image_url
テッセン（鉄線）,"甘い束縛,縛りつける,高潔",つるが鉄の針金（ワイヤー）のように細く強靭であることから「鉄線」。クレマチスの一種。,細いが非常に丈夫なつるで、他の植物や支柱にしっかりと巻き付いて離れない様子から「縛りつける」「甘い束縛」という少し独占欲の強い花言葉がついた。凛とした花姿から「高潔」とも。,5月9日,キンポウゲ科センニンソウ属。中国原産。日本には室町時代に渡来。茶花や着物の柄として古くから愛好されている。6枚の白い花びら（実際はガク）が特徴。,https://upload.wikimedia.org/wikipedia/commons/2/22/Clematis_florida_var._sieboldiana.jpg
デージー,"純潔,美人,平和,希望",ラテン語の「dais（日の眼）」が語源で、太陽の光を受けると花を開き、黄色い花芯を見せることから。和名は「雛菊（ヒナギク）」。,小さく可愛らしい花姿が、無垢な子供や清純な少女を連想させることから「純潔」。踏まれてもまた立ち上がって花を咲かせる強さから、困難の中にある「希望」や「平和」の象徴とされる。,"1月4日,2月15日,3月6日",キク科ヒナギク属。欧州原産。イタリアの国花。乙女の象徴とされ、花占い（好き、嫌い…）に使われる代表的な花の一つ。,https://upload.wikimedia.org/wikipedia/commons/e/e7/Bellis_perennis_white_%28aka%29.jpg
デンファレ,"お似合いのふたり,わがままな美人,魅惑",正式名称は「デンドロビウム・ファレノプシス」。デンドロビウムの仲間で、ファレノプシス（胡蝶蘭）に似た花を咲かせることから略してデンファレ。,胡蝶蘭のような優雅な花を、茎の先に連なって咲かせる姿が非常に華やかで、釣り合いの取れた美しさを持つことから「お似合いのふたり」。その美しさと、栽培に少しコツがいる点から「わがままな美人」とも。,"1月17日,1月20日,11月27日",ラン科セッコク属。オーストラリア、ニューギニア原産。ハワイのレイ（首飾り）の材料として有名。切り花としての持ちが良く、ブーケによく使われる。,https://upload.wikimedia.org/wikipedia/commons/e/ed/Dendrobium_phalaenopsis_1.jpg
トケイソウ（時計草）,"聖なる愛,信仰,宗教的熱情",花の形が時計の文字盤に見えることから「時計草」。英名は「パッションフラワー（受難の花）」。,独特の雄しべと雌しべの形を、キリストが十字架に架けられた際の受難（釘や茨の冠）に見立てたことから、キリスト教の「信仰」や「聖なる愛」を象徴する花とされた。,6月27日,トケイソウ科トケイソウ属。中南米原産。実がなる種類は「パッションフルーツ」として食用になる。ユニークな花の形は、一度見ると忘れられない。,https://upload.wikimedia.org/wikipedia/commons/3/3d/Passiflora_caerulea_flower_close-up.jpg
トリカブト（鳥兜）,"騎士道,栄光,人嫌い,復讐",花の形が、舞楽の衣装である「鳥兜（とりかぶと）」や、西洋の騎士のヘルメットに似ていることから。,騎士の兜に似た勇ましい花姿から「騎士道」「栄光」。しかし、世界最強クラスの猛毒（アコニチン）を持つことから、関わるものを死に至らしめる「復讐」や、誰も寄せ付けない「人嫌い」という二面性を持つ。,"1月11日,8月11日",キンポウゲ科トリカブト属。北半球に分布。矢毒として使われた歴史がある。美しい青紫色の花を咲かせるが、絶対に口にしてはいけない。,https://upload.wikimedia.org/wikipedia/commons/9/91/Aconitum_napellus_Inflorescence.jpg
ドクダミ（蕺草）,"野生,白い追憶,自己犠牲",毒を抑える（毒矯み）薬効があることから、または独特の臭気があることから「毒溜み」など諸説ある。,湿った日陰に群生し、踏まれても枯れないたくましさから「野生」。全草に強い臭気があるが、乾燥させてお茶にすると無臭になり、優れた薬効で人々を癒やすことから、我が身を呈して尽くす「自己犠牲」。,5月15日,ドクダミ科ドクダミ属。東アジア原産。別名「十薬（じゅうやく）」と呼ばれ、解毒や利尿など10種類の薬効があるとされる万能薬草。白い十字の花（総苞片）が清楚。,https://upload.wikimedia.org/wikipedia/commons/5/5f/Houttuynia_cordata_flowers.jpg
ドラセナ,"幸福,永遠の愛,隠しきれない幸せ",ハワイでは「幸福の木」として親しまれ、家の前に置くと幸せが訪れるという言い伝えがあることから。,生命力が非常に強く、切り取った枝を水に挿しておくだけでも発根して育つことから、尽きることのない「永遠の愛」や、溢れ出る「隠しきれない幸せ」を象徴する。,12月1日,キジカクシ科（リュウゼツラン科）ドラセナ属。熱帯アフリカ原産。「幸福の木（マッサンゲアナ）」や「ミリオンバンブー」など多くの種類があり、贈り物として大人気。,https://upload.wikimedia.org/wikipedia/commons/5/52/Dracaena_fragrans_foliage.jpg
トリトマ,"恋の痛み,あなたを思うと胸が痛む",鮮やかなオレンジ色の花穂が、まるで恋に焦がれて胸を焼かれる心情を表しているように見えることから。その情熱的な姿は見る人に強いインパクトを与える。,"8月4日,9月15日",ツルボラン科シャグマユリ属。南アフリカ原産。ユニークな形がエキゾチックで、大型の宿根草としてガーデニングのアクセントになる。英名は「Red hot poker（赤く焼けた火掻き棒）」や「Torch lily（たいまつ百合）」と呼ばれ、炎を連想させる名前が多い。,https://upload.wikimedia.org/wikipedia/commons/f/f8/Kniphofia_uvaria_flower.jpg,
トルコキキョウ,"優美,すがすがしい美しさ,希望,よい語らい",原産地はトルコではなく北アメリカ（テキサス州など）だが、蕾のねじれた形がトルコ人のターバンに似ていることや、花色がトルコ石のようだったことから名付けられた。実際はリンドウ科。別名「ユーストマ」。,紫色の凛とした花姿が、夏の暑い季節に涼しげな印象を与えることから「すがすがしい美しさ」。品種改良により生まれた、幾重にも重なるフリルのような花びらが、ドレスのように優雅であることから「優美」。,"7月12日,7月18日,8月18日",リンドウ科ユーストマ属。北米原産。日本で品種改良が盛んに行われ、世界的な主要産地となっている。花持ちが非常に良く、色や形も豊富なため、ブライダルフラワーや切り花として不動の人気を誇る。もともとは一重咲きの紫色の花だった。,https://upload.wikimedia.org/wikipedia/commons/2/23/Eustoma_grandiflorum_flower.jpg
ドロソフィルム,不誠実な愛,（※一般的な花言葉データには少ない植物ですが、食虫植物としての特性から解釈）,葉から粘液を出して虫を捕らえる食虫植物であり、甘い蜜のような輝きで虫を誘い寄せ、一度捕まえると逃さない性質から、相手を騙して縛り付ける「不誠実な愛」を連想させる。,該当なし,ドロソフィルム科ドロソフィルム属。ポルトガル、スペイン、モロッコ原産。別名「モチリンゴ（餅林檎）」とも呼ばれるが、これは粘液の粘り気に由来する。美しい黄色い花を咲かせるが、葉は強力な虫取り罠である。,https://upload.wikimedia.org/wikipedia/commons/7/77/Drosophyllum_lusitanicum_flower.jpg
トンボソウ（蜻蛉草）,陽気,花の形が、トンボ（蜻蛉）が飛んでいる姿に似ていることから名付けられた。,湿地や草地で、小さな緑がかった花をたくさん咲かせ、まるでトンボの群れが楽しげに舞っているように見えることから、明るくのどかな「陽気」さを感じさせる。,該当なし,ラン科トンボソウ属。日本全土に分布。地味な花だが、よく見ると確かにトンボのような形をしており、自然の造形の面白さを感じさせる野生ラン。,https://upload.wikimedia.org/wikipedia/commons/9/91/Tulotis_ussuriensis_flower.jpg
トウワタ（唐綿）,"心変わり,私を行かせて",種子に付いている白い綿毛が、唐（外国）から来た綿のようであることから。,秋になると実がはじけ、中から現れた綿毛付きの種が風に乗ってふわふわとどこかへ飛んでいってしまう姿から、気持ちが他へ移る「心変わり」や、束縛を嫌う「私を行かせて」という心情を表す。,10月2日,キョウチクトウ科（ガガイモ科）トウワタ属。熱帯アメリカ原産。花は赤と黄色で鮮やか。茎を切ると出る白い乳液には毒があるが、オオカバマダラという蝶の幼虫はこの葉を食べて体内に毒を蓄え、鳥から身を守る。,https://upload.wikimedia.org/wikipedia/commons/e/e0/Asclepias_curassavica_flower.jpg
トケイソウ（時計草）,"聖なる愛,信仰,宗教的熱情",3つに分かれた雌しべが時計の長針・短針・秒針に見え、花びらが文字盤に見えることから「時計草」。英名は「パッションフラワー（受難の花）」。,16世紀に南米を訪れた宣教師たちが、この花の独特な形をキリストの受難（十字架、釘、茨の冠など）を象徴するものとして捉え、布教に利用したことから「信仰」「聖なる愛」。,6月27日,トケイソウ科トケイソウ属。中南米原産。果実はパッションフルーツ。時計に見えるか、キリストの受難具に見えるか、文化によって見え方が全く異なる面白い植物。,https://upload.wikimedia.org/wikipedia/commons/3/3d/Passiflora_caerulea_flower_close-up.jpg
トリカブト（鳥兜）,"騎士道,栄光,人嫌い,復讐,敵意",花の形が、雅楽で被る鳳凰の頭を模した冠「鳥兜」に似ていることから。,騎士のヘルメットのような勇ましい花姿から「騎士道」「栄光」。しかし、その裏には最強の猛毒を隠し持っていることから、近づく者を破滅させる「復讐」「敵意」という恐ろしい意味も併せ持つ。,"1月11日,8月11日",キンポウゲ科トリカブト属。北半球に分布。世界三大有毒植物の一つ。トリカブト殺人事件などで有名になったが、花自体は非常に美しく、園芸品種も存在する。,https://upload.wikimedia.org/wikipedia/commons/9/91/Aconitum_napellus_Inflorescence.jpg
ドクダミ（蕺草）,"野生,白い追憶,自己犠牲",毒を抑える薬効がある「毒矯み（どくだみ）」が語源とされる。特有の臭気がある。,日陰の湿った場所でも群生する生命力から「野生」。真っ白な十字の花（総苞）が、暗い場所で浮き上がるように咲く姿が、過去の記憶を呼び覚ます「白い追憶」。薬草として自らを煎じて人々を救うことから「自己犠牲」。,5月15日,ドクダミ科ドクダミ属。東アジア原産。日本三大薬草の一つ。乾燥させると臭いが消え、「十薬（じゅうやく）」という生薬になり、お茶や化粧水として広く利用される。,https://upload.wikimedia.org/wikipedia/commons/5/5f/Houttuynia_cordata_flowers.jpg
ドラセナ,"幸福,永遠の愛,隠しきれない幸せ",「幸福の木（マッサンゲアナ）」として知られ、ハワイでは玄関に飾ると幸せを招くとされることから。,生命力が強く、どんな環境でも枯れずに育つことから「永遠の愛」。葉が生き生きと茂り、見る人に元気を与える姿から「隠しきれない幸せ」。新築祝いや結婚祝いの定番。,12月1日,キジカクシ科ドラセナ属。熱帯アフリカ原産。多くの種類があるが、どれも縁起の良い植物として扱われる。ドラセナ・コンシンネは「真実の木」とも呼ばれる。,https://upload.wikimedia.org/wikipedia/commons/5/52/Dracaena_fragrans_foliage.jpg
トリトマ,"恋の痛み,あなたを思うと胸が痛む",花穂の上部が赤、下部が黄色になり、まるで燃える松明（たいまつ）や、赤く焼けた火掻き棒のように見えることから。,心が燃え上がるような激しい恋心や、その熱さゆえの胸の痛みを、赤く焼けた花の姿に重ねて「恋の痛み」とされた。,"8月4日,9月15日",ツルボラン科シャグマユリ属。南アフリカ原産。和名は「赤熊百合（シャグマユリ）」。ユニークなグラデーションカラーが特徴で、エキゾチックな雰囲気を持つ。,https://upload.wikimedia.org/wikipedia/commons/f/f8/Kniphofia_uvaria_flower.jpg
トルコキキョウ,"優美,すがすがしい美しさ,希望,よい語らい",蕾がトルコ人のターバンのように巻いていることや、花色がトルコ石のようであることから。リンドウ科の植物。,フリルのような花びらが重なり合う豪華な八重咲きの品種は、ドレスをまとった貴婦人のように「優美」。原種に近い一重咲きの紫の花は、凛として涼しげで「すがすがしい美しさ」。,"7月12日,7月18日,8月18日",リンドウ科ユーストマ属。北米原産。結婚式のブーケや装花として非常に人気が高い。花言葉が良いものが多く、贈り物として最適。,https://upload.wikimedia.org/wikipedia/commons/2/23/Eustoma_grandiflorum_flower.jpg
ドロソフィルム,不誠実な愛,（※食虫植物としての性質から）,甘い蜜のような粘液で虫を誘惑し、捕らえて消化してしまう食虫植物の性質から、相手を騙して利用する「不誠実な愛」という花言葉がつけられたと考えられる。,該当なし,ドロソフィルム科ドロソフィルム属。イベリア半島原産。別名「モチリンゴ」。粘液がネバネバしており、一度捕まった虫は逃げられない。,https://upload.wikimedia.org/wikipedia/commons/7/77/Drosophyllum_lusitanicum_flower.jpg
トンボソウ（蜻蛉草）,陽気,花の形がトンボに似ていることから。,湿地で小さな花が群れて咲く様子が、トンボたちが楽しげに飛び回っているように見えることから「陽気」。,該当なし,ラン科トンボソウ属。日本全土に分布。目立たない花だが、よく見ると確かにトンボの形をしており、愛嬌がある。,https://upload.wikimedia.org/wikipedia/commons/9/91/Tulotis_ussuriensis_flower.jpg
トウワタ（唐綿）,"心変わり,私を行かせて",種についた綿毛が、唐（外国）から来た綿のようであることから。,実が熟すとはじけ、綿毛のついた種が風に乗ってふわふわと飛んでいってしまう様子が、一つの場所に留まらない「心変わり」や、自由を求める「私を行かせて」という心情を表す。,10月2日,キョウチクトウ科トウワタ属。熱帯アメリカ原産。花は赤と黄色で鮮やか。茎を折ると出る白い乳液には毒があるが、蝶の幼虫はこの毒を利用して身を守る。,https://upload.wikimedia.org/wikipedia/commons/e/e0/Asclepias_curassavica_flower.jpg
トケイソウ（時計草）,"聖なる愛,信仰,宗教的熱情",花の形が時計の文字盤に見えることから「時計草」。英名は「パッションフラワー（受難の花）」。,十字架上のキリストの受難（パッション）を象徴する花として、宣教師たちによって広められた歴史から、深く強い「信仰」や「聖なる愛」を意味する。,6月27日,トケイソウ科トケイソウ属。中南米原産。非常にユニークな形の花。実がなる種類はパッションフルーツとして親しまれている。,https://upload.wikimedia.org/wikipedia/commons/3/3d/Passiflora_caerulea_flower_close-up.jpg
トリカブト（鳥兜）,"騎士道,栄光,人嫌い,復讐,敵意",花の形が舞楽の「鳥兜」や騎士の兜に似ていることから。,兜のような勇ましい姿から「騎士道」「栄光」。しかし、猛毒を持つことから、関わる者を破滅させる「復讐」や「敵意」という裏の意味も強く持つ。,"1月11日,8月11日",キンポウゲ科トリカブト属。北半球に分布。トリカブトの毒はアコニチンと呼ばれ、摂取すると呼吸困難を引き起こす。美しい花には棘ならぬ毒がある。,https://upload.wikimedia.org/wikipedia/commons/9/91/Aconitum_napellus_Inflorescence.jpg
ドクダミ（蕺草）,"野生,白い追憶,自己犠牲",毒を抑える「毒矯み」が転じたとされる。独特の臭気がある。,どこにでも生えるたくましさから「野生」。白い花が暗闇でぼんやりと浮かぶ姿から「白い追憶」。自らを薬として捧げることから「自己犠牲」。,5月15日,ドクダミ科ドクダミ属。東アジア原産。日本三大薬草の一つ。お茶や化粧水として利用される身近な薬草。,https://upload.wikimedia.org/wikipedia/commons/5/5f/Houttuynia_cordata_flowers.jpg
ドラセナ,"幸福,永遠の愛,隠しきれない幸せ",「幸福の木」として知られ、ハワイでは幸せを招くと言い伝えられていることから。,生命力が強く、いつまでも緑を保つことから「永遠の愛」。葉が生き生きと茂る様子から「隠しきれない幸せ」。,12月1日,キジカクシ科ドラセナ属。熱帯アフリカ原産。贈り物として非常に人気があり、花言葉もポジティブなものばかり。,https://upload.wikimedia.org/wikipedia/commons/5/52/Dracaena_fragrans_foliage.jpg
トリトマ,"恋の痛み,あなたを思うと胸が痛む",花の色が赤から黄色へのグラデーションになっており、燃える火掻き棒のように見えることから。,胸を焦がすような激しい恋の情熱と、それに伴う切なさや痛みを、赤く焼けた花の姿に重ねて表現した言葉。,"8月4日,9月15日",ツルボラン科シャグマユリ属。南アフリカ原産。別名「トーチリリー（たいまつ百合）」。燃え盛る炎のような花姿が印象的。,https://upload.wikimedia.org/wikipedia/commons/f/f8/Kniphofia_uvaria_flower.jpg
トルコキキョウ,"優美,すがすがしい美しさ,希望,よい語らい",蕾の形がトルコ人のターバンに似ていることから。実際はリンドウ科。,紫色の花が持つ凛とした美しさから「すがすがしい美しさ」。フリルのある優雅な花姿から「優美」。花言葉が良く、見た目も華やかなため、贈り物やブライダルに最適。,"7月12日,7月18日,8月18日",リンドウ科ユーストマ属。北米原産。日本で品種改良が進み、世界中で愛される花となった。一重咲き、八重咲き、フリンジ咲きなど多様な形がある。,https://upload.wikimedia.org/wikipedia/commons/2/23/Eustoma_grandiflorum_flower.jpg
ドロソフィルム,不誠実な愛,（※食虫植物としての性質から）,粘液で虫を誘い寄せ、捕らえて消化してしまう性質から、甘い言葉で近づき相手を破滅させる「不誠実な愛」を象徴する。,該当なし,ドロソフィルム科ドロソフィルム属。イベリア半島原産。美しい花を咲かせるが、葉は強力な粘着力を持つ食虫植物。,https://upload.wikimedia.org/wikipedia/commons/7/77/Drosophyllum_lusitanicum_flower.jpg
トンボソウ（蜻蛉草）,陽気,花の形がトンボに似ていることから。,湿地で群れて咲く小さな花が、トンボたちが集まって遊んでいるように見えることから、明るくのどかな「陽気」さを表す。,該当なし,ラン科トンボソウ属。日本全土に分布。自然の中で見つけると嬉しい、愛嬌のある形の野生ラン。,https://upload.wikimedia.org/wikipedia/commons/9/91/Tulotis_ussuriensis_flower.jpg
トウワタ（唐綿）,"心変わり,私を行かせて",種についた綿毛が唐から来た綿のようであることから。,実が熟すと綿毛のついた種が風に乗って飛んでいく様子が、一つの愛に留まらない「心変わり」や、束縛から逃れたい「私を行かせて」という気持ちを表す。,10月2日,キョウチクトウ科トウワタ属。熱帯アメリカ原産。花は鮮やかで美しいが、有毒植物。蝶の幼虫が身を守るためにこの毒を利用する共生関係が知られる。,https://upload.wikimedia.org/wikipedia/commons/e/e0/Asclepias_curassavica_flower.jpg
